general_message,candidate_name,first_name,last_name,position,department,start_date,salary,location,location_type,location_city,location_region,location_country,location_country_code,location_remote_policy,email,access_europe,access_north_america,access_south_america,access_africa,access_asia,access_oceania
"Hey team, we’re bringing Michael Caldwell on board as an HR Generalist in the Legal department, and he’ll be starting on December 22, 2025. He’ll be based in Berlin, Germany, and his salary will be $153,000.

Let’s make sure everything is set for his arrival. Excited to have him join the team!",Michael Caldwell,Michael,Caldwell,HR Generalist,Legal,2025-12-22,153000.0,"Berlin, Germany",onsite,Berlin,,Germany,DE,,michael.caldwell@company.com,1.0,0.0,0.0,0.0,0.0,0.0
"Just a quick note to confirm we’ve hired Robert Howard for the Machine Learning Engineer position in Finance. 

He’ll be starting on February 28, 2026, with a salary of $173,000, and his email is robert.howard@company.com. He’ll be based in San Francisco, CA, United States. Thanks!",Robert Howard,Robert,Howard,Machine Learning Engineer,Finance,2026-02-28,173000.0,"San Francisco, CA, United States",onsite,San Francisco,CA,United States,US,,robert.howard@company.com,0.0,1.0,0.0,0.0,0.0,0.0
"I’m excited to confirm that we’ve selected Kayla Cooper for the Product Designer role in the R&D department. She’ll be based out of our Dublin, Ireland office, and her start date is still to be decided. 

We’re bringing her on with a salary of €87,000. I think she'll be a fantastic addition to the team! 😊",Kayla Cooper,Kayla,Cooper,Product Designer,R&D,TBD,87000.0,"Dublin, Ireland",onsite,Dublin,,Ireland,IE,,kayla.cooper@company.com,1.0,0.0,0.0,0.0,0.0,0.0
"Hi team,

I’m excited to confirm that we’re bringing on Karen Hoover as our IT Support Contractor with a start date of March 12, 2026. She’ll be based in Tokyo, Japan, and her salary will be $63,000. 

Let’s ensure everything is ready for her onboarding process!",Karen Hoover,Karen,Hoover,IT Support Contractor,Business Intelligence,2026-03-12,63000.0,"Tokyo, Japan",onsite,Tokyo,,Japan,JP,,karen.hoover@company.com,0.0,0.0,0.0,0.0,1.0,0.0
"Hey Team!

I’m thrilled to confirm our new hire for the Junior Data Analyst position—Henry Rowland! He’s set to join our Legal department in Zurich, Switzerland, with a start date of ASAP. We’re bringing him on at a competitive salary of $75,000. 

Can’t wait to see him get started and contribute to the team! Let’s make this welcoming process smooth for him. 🎉",Henry Rowland,Henry,Rowland,Junior Data Analyst,Legal,ASAP,75000.0,"Zurich, Switzerland",onsite,Zurich,,Switzerland,CH,,henry.rowland@company.com,1.0,0.0,0.0,0.0,0.0,0.0
"Hey team,

I’m excited to confirm that we’re bringing Bryan Perry on board as a Software Engineer I in the Design department, starting December 23, 2025. He’ll be based out of Toronto, ON, Canada, with a salary of $197,000. His email will be bryan.perry@company.com.

Looking forward to seeing the impact he’ll make on the team! Let’s get the ball rolling on onboarding.",Bryan Perry,Bryan,Perry,Software Engineer I,Design,2025-12-23,197000.0,"Toronto, ON, Canada",onsite,Toronto,ON,Canada,CA,,bryan.perry@company.com,0.0,1.0,0.0,0.0,0.0,0.0
